reviewer_name,user_country,room_type,stay_duration_days,rating,review_text,review_date
Malena,Germany,Honeymoon Villa,2,10.0,"Hier hat sich jemand bei der Konzeption der Anlage wirklich Gedanken gemacht. Inmitten eines wunderschönen exotischen Gartens ziehen sich die gut platzierten Bungalows bis hin zu einer Klippe. Wunderbare Aussichten, Zugang zu einem kleinen Privatstrand und einer der harmonischsten Pools, in denen ich bisher geschwommen bin.
Putu und Made haben sich sehr gut um uns gekümmert. Terima kasih! Wir kommen ganz sicher bald wieder.","January 29, 2026"
Birgit,Germany,Honeymoon Suite Room,5,10.0,"Sehr schöne und ruhige Anlage mit ca 12 Bungalows in einem sehr großen Garten, 3 Bungalows (Honeymoonsuiten) mit direktem Blick auf das Meer. Das erste Hotel in Bali, in dem wir schneeweiße Handtücher und neue Bettwäsche hatten.  Zudem sind die Zimmer sehr geräumig, mit Klimaanlage und Fan, bequemes Bett, großes Bad mit sauberer Dusche, großer Badewanne und viel Ablagefläche.  An dem großen und gepflegtem Pool bekommt man immer freie Liegen. Das gesamte Hotel- und Restaurantpersonal ist sehr freundlich und zuvorkommend. 
Ein Highlight ist das Essen in dem kleinen Restaurant. Es wird alles frisch zubereitet, dauert zwar etwas länger, aber das Warten lohnt sich, alles schmeckt ausgezeichnet zu normalen Preisen. Zudem werden leckeres Brot und Kuchen selbst gebacken, Ravioli, Fettuchine, Bacon, Pesto, leckere Papayamarmelade und Eis sind ebenfalls homemade. Alle Gerichte werden liebevoll und mit frischen Kräutern angerichtet. Zum Frühstück gibt es eine Karte mit Auswahl verschiedener Gerichte, alles lecker und sehr reichlich. Auch unser erstes Hotel, in dem wir 6-7 verschiedene Früchte im Fruitsalad zum Frühstück bekommen haben. Trinkwasser kann man sich im Restaurant in jeder Menge auffüllen.
Von der Restaurantterrasse hat man einen herrlichen Blick auf die Secret Bay. Von  10 Pkt. vergeben wir an  Küche und Restaurant 12 Punkte. 

Über einen kleinen Naturweg läuft man ca 10 min zur Mejan Beach, wo man herrlich lange Strandwanderungen unternehmen kann. Im Ort gibt es Supermärkte und einen Nachtmarkt ( ca 20 min Fußweg).

Wir hatten 5 Nächte gebucht, haben uns aber so wohl gefühlt (trotz einiger Regentage), dass wir noch 3 Nächte verlängert haben und kommen in unserem nächsten Urlaub auf jeden Fall zurück ins Gajah Mina Beach Resort. Vielen Dank allen Angestellten für unseren schönen und erholsamen Aufenthalt.
Birgit und Ronald","February 12, 2025"
Martina,Austria,1 Bedroom Sea View,2,9.6,I was positively surprised. The bed was very comfortable and there were no insects in the room.,"December 28, 2023"
Christian,Germany,1 Bedroom Sea View,4,8.0,"Es liegt mitten an einem Strand beim Essen kann der Blick aufs Meer schweifen und so teuer ist das Restaurant auch nicht, die Portionen sind nämlich schön groß. Man wartet nur etwas länger aufs Essen (balinesische Gemütlichkeit), wer aber Angst vor Ameisen oder Sonstigem hat, sollte am besten ein anderes Hotel suchen, wir fanden es schön da man gefühlt mit der Natur zusammen lebt.","April 21, 2023"
ilka,Germany,N/A,6,3.3,"wir haben den Aufenhalt sehr genossen und hatten eine tolle Zeit.
Das Hotel ist allerdings ein paar Minuten vom Strand entfernt, dafür hat man totale Ruhe und kann diese geniessen.
Die Bungalows sind shr schön, richtig zum wohlfühlen.","October 08, 2014"
Raffaele,Italy,Honeymoon Villa,2,8.0,"Sembra di essere soli in mezzo alle palme e  alla vegetazione....ma in realtà le unità abitative sono sparse per la proprietà in maniera ottimale.
Per chi vuole un'esperienza ""isolati"" dal mondo, ma in realtà all'interno di una struttura sicura e che ti accoglie con la rinomata gentilezza Balinese.","January 01, 2024"
Elena,Indonesia,1-Bedroom Garden View Villa,4,7.2,"Il resort si trova su un promontorio direttamente sull'oceano, quindi dal ristorante e da alcune camere la vista è fantastica. La piscina è molto bella e rilassante. La cucina buona. Le stanze sono un po' vecchie, non pulitissime, il letto comodo. Sono in mezzo alla natura, quindi sarà probabile avere insetti e gechi in camera","January 08, 2024"
Rob,Netherlands,1 Bedroom Sea View,3,8.8,Wij kwamen rond middernacht aan en hadden dus geen idee waar we terecht gekomen waren. Toen we ‘s morgens de gordijnen openden waanden we ons in het paradijs. De privé bungalows liggen in een prachtige tuin die grenst aan een verborgen inham in de kustlijn. Het restaurant serveert heerlijk eten en het personeel is vriendelijk. Het resort is misschien een beetje verouderd maar wij vonden dit een fantastische start van onze vakantie op Bali. Niet onbelangrijk; de bedden liggen heerlijk.,"January 09, 2024"
soegiarto,Indonesia,1-Bedroom Garden View Villa,1,4.0,"Lokasi hotel masuk ke jalan sempit dan kurang petunjuk arah, staff ramah, hotel banyak nyamuk, semut merah dan serangga, pelayanan di resto terutama untuk dinner sangat lama padahal tidak ada pesanan tamu lain, area penerangan di dalam area hotel sangat terbatas, banyak lampu jalan di dalam hotel yang mati tapi terkesan dibiarkan, breakfast minimalis sekali","June 03, 2023"
soegiarto,Indonesia,1 Bedroom Sea View,1,4.8,"Lokasi hotel ini bukan di tepi jalan raya tapi harus masuk jalan desa yang sempit. Lampu di jalan setapak hotel banyak yang mati sehingga tamu butuh senter untuk jalan di malam hari. Banyak nyamuk, semut merah besar di area kamar sangat menggangu bagi kami yang membawa anak kecil","May 01, 2023"
yang,China,1-Bedroom Garden View Villa,5,7.6,性价比高，就是地点有点偏，离机场好远，如果要赶飞机的起码需要提早3小时开始出发去机场，其它的都不错，如果卫生再好一点就完美了😊,"November 17, 2023"
Anas,Indonesia,1 Bedroom Sea View,1,9.2,Lengkapi pasta gigi karena kalo mau beli cukup jauh,"October 02, 2024"
Ayu,Indonesia,1 Bedroom Sea View,1,7.6,"Untuk anda yg mencari ketenangan dan ingin me time bersama pasangan, ini pilihan yg cocok.","February 01, 2023"
Anis,Indonesia,1-Bedroom Garden View Villa,1,9.6,"Recomended..
Kalau ke bali lagi, pasti saya ke gajah mina resort lg..","December 29, 2022"
Odelia,Indonesia,Honeymoon Villa,1,3.2,"Seandainya terdapat pilihan tidak ada bintang saya kasi tidak ada bintang. Sangat tidak direkomendasikan.
1. Penerangan di semua area resort sangat minim, bahkan di sepanjang jalan menuju villa honeymoon-1 yang lokasinya di ujung paling dekat dengan pantai kondisi jalannya gelap tanpa penerangan sama sekali atau lampu-lampu dibiarkan mati.
2. Banyak semut masuk ke kamar, sampai naik ke tempat tidur.
3. Penanganan komplain sangat lamban.
4. Sulit untuk mendapatkan makanan dikarenakan lokasi resort sangat pelosok,
Sedangkan di resto ketersediaan jenis makanan sangat terbatas atau minim macamnya.
5. Sikat gigi dan pasta gigi tidak ada","December 30, 2022"
Aneke,Indonesia,1 Bedroom Sea View,1,3.6,Utk fasilitas di hotel hrs diperhatikan thx,"April 10, 2024"
Makarik,Russia,1 Bedroom Sea View,3,8.4,"Отдыхали с 23 по 26 октября. Тихий отель на берегу океана. Людей мало, отдыхать комфортно. Маленькие виллы с душем на улице. При заезде были проблемы с кондиционером, после днем работает не сильно, вечером в ночь, хорошо работал. Интернет хороший, но не скоростной, работает. При отеле есть что покушать, но вкуснее кухня недалеко от отеля, есть несколько ресторанов так же на побережье в ходьбе 15 минут или на байке 2 минуты. Завтраки на 3, кофе растворимый, чай из пакетиков, лучше без завтраков, в других местах кушать. Территория у отеля хорошая, небольшая, но домики рассредоточены так, что комфортно находится там, никто никому не мешает. Про уборку спрашивают, если нужно, то убирают. Есть вода. Бассейн метров 15. Красивый вид из ресторана на океан. В окрестностях рисовые красивые поля и пальмовые рощи, если пройтись вдоль океана прогуляться, открываются красивые виды, людей очень мало. Есть место где занимаются сёрфингом. Фрукты рядом не купить. Есть продуктовые сетевые магазины. Отдых для тех кто любит тишину и спокойствие. Прекрасная массажистка и цены очень приемлемые. Рекомендосье.","October 28, 2024"
Алена,Indonesia,1 Bedroom Sea View,1,10.0,"Это по-настоящему тайная бухта:  море с большими волнами между скал, секретные тропы через пещеры с летучими мышами, безумно красивые тайные пляжи, о которых знают только местные, чёрный вулканический песок и невероятная красота. Я искренне советую это место всем – мы были в 10 разных отелях на Бали до этого (Карангасем, Амед, Гили, Ловина, Убуд), и я скажу точно: этот отель и его территория самые красивые, интересные, уникальные из всех, что мы видели. Всё можно построить, но природу и саму локацию победить невозможно: здесь она явно даёт отелю огромное преимущество перед всеми другими местами. Да, сам отель и его домики – прекрасные, по цене и комфорту (это действительно отдельные маленькие виллы по стоимости гостиничного номера) мы не нашли ничего лучше. Мы оставались там на пару ночей, но в итоге продлили на 2 недели )) Если приедем на Бали на пару месяцев снова – на весь срок останемся там. Однозначно советую всем","February 17, 2023"
Алена,Indonesia,Honeymoon Villa,1,10.0,"Уже писала отзыв про это место: мы оставались на пару ночей, но в итоге забронировали на 2 недели )) поэтому отзывы запрашивают на оба бронирования.
Место поистине лучшее из всех, что мы видели на Бали, а мы были на тот момент в 10 отелях как минимум, так как путешествуем.
В другом отзыве написала подробную рецензию на пребывание, спойлер: не думайте вообще, бронируйте номер (у них это целые отдельные виллы!!) и езжайте туда на длительный срок, это в действительности незабываемое место. И спросите у сотрудников, как пройти через пещеру с летучими мышами на секретный пляж !!)) Они не болтают об этом, но если попросить – расскажут ) снова спойлер: это ВАУ. Удачного путешествия !","February 17, 2023"
Makarik,Russia,1 Bedroom Sea View,6,10.0,"Превосходное место, вернулись сюда во второй раз на месяц! Тихо, спокойно, настоящее Бали. Вокруг пляжи, есть различные кафе.","November 24, 2024"
TATIANA,Russia,1-Bedroom Garden View Villa,2,10.0,"Отличное и спокойное местечко, очень люблю здесь бывать!","October 22, 2025"
John,Russia,1-Bedroom Garden View Villa,3,10.0,"Здесь как будто своя вселенная, отдельная от всего мира.","December 07, 2023"
Alexey,South Africa,1-Bedroom Garden View Villa,1,10.0,"В январе 2022 отель был почти пустой. Номера - необычные домики, чистые и комфортные. Ресторан вкусный и не дорогой. Но главное - это утесы на которых можно сидеть, свесив ноги над пропастью, и провожать закат с бутылочкой вина!","January 24, 2022"
Daniela,Italy,1 Bedroom Sea View,14,9.6,Traumhafte lage nettes hilfbereites personal. Restaurant topp.,"May 14, 2023"
Kai-Wen,Taiwan,1 Bedroom Sea View,1,2.0,爛透了,"December 19, 2023"
Mary,Malaysia,1-Bedroom Garden View Villa,1,9.2,"My villa was clean, cool and peaceful I absolutely loved staying here. The pool was lovely. The beach was empty most of the time which is exactly what I was looking for. Spot to watch sunset with a coconut. Really good value for money! Only downside was tricky location, I couldn't order a Grab or Gojek even from the main road. But otherwise I enjoyed it all!","October 25, 2023"
Sonja,Australia,1-Bedroom Garden View Villa,2,10.0,"Loved staying here. Fantastic quiet location with stunning views.  The food was delicious, just be prepared to wait. Possibly need more kitchen staff.","July 30, 2023"
Kylie,Australia,Honeymoon Villa,1,7.2,"We booked the honeymoon bungalow at the last minute, we had fantastic uninterrupted views of the ocean. Very magical view and on top of a cliff. Pool facilities were great. Very large property with lots of space for familys.","October 05, 2023"
