username,user_country,room_view,stay_duration,stay_type,review_post_date,review_title,rating,original_lang,review_text_liked,review_text_disliked,full_review,en_full_review,found_helpful,found_unhelpful,owner_resp_text
Shehan,United Arab Emirates,Standard Villa,1 night,Couple,05-24-2024 00:00:00,Perfect stay,10.0,en-us,Everything.. one of the best hotels I stayed in bali.. everything was perfect.. i came to know that they’ve opened recently and we were impressed.. the boy who welcomed us so friendly and he speaks English so well.. bathrooms/ room cleanness was 10 out of 10,Nothing much.. but I would suggest if they could update their room rate including the village entrance fee.. as we were bit surprised once we entered to the village where the hotel located and we had to pay 10k per person just to enter..,title: Perfect stay. liked: Everything.. one of the best hotels I stayed in bali.. everything was perfect.. i came to know that they’ve opened recently and we were impressed.. the boy who welcomed us so friendly and he speaks English so well.. bathrooms/ room cleanness was 10 out of 10. disliked: Nothing much.. but I would suggest if they could update their room rate including the village entrance fee.. as we were bit surprised once we entered to the village where the hotel located and we had to pay 10k per person just to enter..,title: Perfect stay. liked: Everything.. one of the best hotels I stayed in bali.. everything was perfect.. i came to know that they’ve opened recently and we were impressed.. the boy who welcomed us so friendly and he speaks English so well.. bathrooms/ room cleanness was 10 out of 10. disliked: Nothing much.. but I would suggest if they could update their room rate including the village entrance fee.. as we were bit surprised once we entered to the village where the hotel located and we had to pay 10k per person just to enter..,0,0,"Dear Mr. Jailabdeen, Thank you very much for spending your time to wrote a meaningful review for us. Your detailed review is helping us towards our improvement. Should time brought you back again to Bali, we are here looking forward to welcoming you back in our tiny cabin in Bedugul. Regards, Putu Andre"
Kairou,Taiwan,Superior Villa,1 night,Group,04-09-2024 00:00:00,Exceptional,10.0,en-us,"i like the environment/surrounding is so quiet, you can see so many stars in the night. there is a walkable path just outside of this villa can walk around the lake the staff and management are very friendly and super helpful the food in their restaurant is the bomb, so good, i love their soto ayam so much shower water is hot but a bit low water pressure",the road is very dark there in the night and a bit confused to navigate,"title: Exceptional. liked: i like the environment/surrounding is so quiet, you can see so many stars in the night. there is a walkable path just outside of this villa can walk around the lake the staff and management are very friendly and super helpful the food in their restaurant is the bomb, so good, i love their soto ayam so much shower water is hot but a bit low water pressure. disliked: the road is very dark there in the night and a bit confused to navigate.","title: Exceptional. liked: i like the environment/surrounding is so quiet, you can see so many stars in the night. there is a walkable path just outside of this villa can walk around the lake the staff and management are very friendly and super helpful the food in their restaurant is the bomb, so good, i love their soto ayam so much shower water is hot but a bit low water pressure. disliked: the road is very dark there in the night and a bit confused to navigate.",0,0,
Louise,United Kingdom,Superior Villa,3 nights,Solo traveller,04-01-2024 00:00:00,"Fabulous staff, great value for money, and great location",10.0,en,"Very nice villas opposite a beautiful lake that you can access near the property. What stood out for me was the staff. Super friendly, always had my best interests at heart. Brought me food even when the restaurant was closed. So kind. They even helped fix my scooter! Will definitely if in the area. The landscaped gardens were beautiful too. Great value! And really nice shower wash and shampoo!",Nothing,"title: Fabulous staff, great value for money, and great location. liked: Very nice villas opposite a beautiful lake that you can access near the property. What stood out for me was the staff. Super friendly, always had my best interests at heart. Brought me food even when the restaurant was closed. So kind. They even helped fix my scooter! Will definitely if in the area. The landscaped gardens were beautiful too. Great value! And really nice shower wash and shampoo! disliked: Nothing.","title: Fabulous staff, great value for money, and great location. liked: Very nice villas opposite a beautiful lake that you can access near the property. What stood out for me was the staff. Super friendly, always had my best interests at heart. Brought me food even when the restaurant was closed. So kind. They even helped fix my scooter! Will definitely if in the area. The landscaped gardens were beautiful too. Great value! And really nice shower wash and shampoo! disliked: Nothing.",0,0,
Ira,Ukraine,Standard Villa,2 nights,Solo traveller,03-31-2024 00:00:00,Exceptional,10.0,en,"The people and their hospitality were amazing. The place is quiet, in a very nice area near the Lake and Temple. Also it's surrounded by many great locations. The bed is awesome.",Don't leave sweet food on the table in the room. Ants attack it straight away.,"title: Exceptional. liked: The people and their hospitality were amazing. The place is quiet, in a very nice area near the Lake and Temple. Also it's surrounded by many great locations. The bed is awesome. disliked: Don't leave sweet food on the table in the room. Ants attack it straight away.","title: Exceptional. liked: The people and their hospitality were amazing. The place is quiet, in a very nice area near the Lake and Temple. Also it's surrounded by many great locations. The bed is awesome. disliked: Don't leave sweet food on the table in the room. Ants attack it straight away.",0,0,"Dear Ms. Ira Thank you very much for your kind review, we all here really love to read it. The feedback for the ants is well received and we have done our regular pest control to keep it at the minimum. But since we are in the middle of the holticultur farm and open air concept, the natural life are still common. Thank you once again. Regards, Putu Andre"
John,Australia,Standard Villa,2 nights,Couple,03-26-2024 00:00:00,Helpful staff let down by the restaurant.,6.0,en,"The staff , very helpful with any request.","Very limited menu , very slow service . Smoking allowed in the restaurant. Tables not cleaned down. 8.00 am start to breakfast is too late. Food was very unappetising even for those who were hungry.","title: Helpful staff let down by the restaurant. liked: The staff , very helpful with any request. disliked: Very limited menu , very slow service . Smoking allowed in the restaurant. Tables not cleaned down. 8.00 am start to breakfast is too late. Food was very unappetising even for those who were hungry.","title: Helpful staff let down by the restaurant. liked: The staff , very helpful with any request. disliked: Very limited menu , very slow service . Smoking allowed in the restaurant. Tables not cleaned down. 8.00 am start to breakfast is too late. Food was very unappetising even for those who were hungry.",0,0,
Kyle,Australia,Deluxe Villa,1 night,Group,03-23-2024 00:00:00,Exceptional,10.0,en,"The staff were exceptional! So friendly, so helpful with everything we asked for. They really made the stay easy and enjoyable and were very accommodating. The rooms were very clean and comfortable. Slept amazingly. They even provided me with a pedestal fan for some white noise to help me sleep better.",My room didn't have hot water. I didn't mention this to them as I was only there 2 nights.,"title: Exceptional. liked: The staff were exceptional! So friendly, so helpful with everything we asked for. They really made the stay easy and enjoyable and were very accommodating. The rooms were very clean and comfortable. Slept amazingly. They even provided me with a pedestal fan for some white noise to help me sleep better. disliked: My room didn't have hot water. I didn't mention this to them as I was only there 2 nights.","title: Exceptional. liked: The staff were exceptional! So friendly, so helpful with everything we asked for. They really made the stay easy and enjoyable and were very accommodating. The rooms were very clean and comfortable. Slept amazingly. They even provided me with a pedestal fan for some white noise to help me sleep better. disliked: My room didn't have hot water. I didn't mention this to them as I was only there 2 nights.",0,0,"Dear Mr/s. Kyle, Thank you very much for a kind feedback for our place and the staff. All of them, really love to wrote this amazing review from you. We do apologize if during your stay, you facing a bit problem with the hot water which is actually supposed to not happened. If time brought you back to Bedugul, we are really looking forward to welcoming you again in our better circumstances. Kind Regards, Putu Andre"
Matthew,Thailand,Standard Villa,1 night,Group,03-23-2024 00:00:00,Amazing.,10.0,en,"Brand new bungalows very comfy bedding and good showers, awesome location right near the trail hike up to mt Catur and right on the lake.",Old strawberry farm turned into luxurious bungalows with amazing views.,"title: Amazing. liked: Brand new bungalows very comfy bedding and good showers, awesome location right near the trail hike up to mt Catur and right on the lake. disliked: Old strawberry farm turned into luxurious bungalows with amazing views.","title: Amazing. liked: Brand new bungalows very comfy bedding and good showers, awesome location right near the trail hike up to mt Catur and right on the lake. disliked: Old strawberry farm turned into luxurious bungalows with amazing views.",0,0,
Anthony,Australia,Standard Villa,1 night,Couple,03-06-2024 00:00:00,Outstanding,10.0,en,The staff were so warm and inviting. Our staff were truely the soul bali.,We had to check out 🥺😢😭,title: Outstanding. liked: The staff were so warm and inviting. Our staff were truely the soul bali. disliked: We had to check out 🥺😢😭.,title: Outstanding. liked: The staff were so warm and inviting. Our staff were truely the soul bali. disliked: We had to check out 🥺😢😭.,0,0,"Dear Mr. Anthony, We sincerely appreciate you affording your valuable time and completing our survey which provides us treasured insight about your stay. Glad to know that you love our location and surrounding area. We are all looking forward to welcoming you again here in Bedugul. Kind Regards, Putu Andre"
Aleksei,Russia,Standard Villa,3 nights,Couple,02-27-2024 00:00:00,Exceptional,10.0,en-us,"All was great! Place is calm and beautiful. Unfortunately we got sick and staff offered us Ginger tea, bananas, water for free",None,"title: Exceptional. liked: All was great! Place is calm and beautiful. Unfortunately we got sick and staff offered us Ginger tea, bananas, water for free. disliked: None.","title: Exceptional. liked: All was great! Place is calm and beautiful. Unfortunately we got sick and staff offered us Ginger tea, bananas, water for free. disliked: None.",0,0,"Dear Mr. Aleksei, Thank you very much for your kind review for us, and we are all here wishing you and your partner a good health. Feel free to visit us whenever times bring you back to Bedugul. Kind Regards, Andre"
Sasiorn,Thailand,Superior Villa,1 night,Family,01-29-2024 00:00:00,Exceptional,10.0,en,"Fresh air ,location is good","Nothing,everything is good","title: Exceptional. liked: Fresh air ,location is good. disliked: Nothing,everything is good.","title: Exceptional. liked: Fresh air ,location is good. disliked: Nothing,everything is good.",0,0,"Dear Mr/s. Saisorn, Thank you very much for taking up your valuable time to wrote us a valuable review. We are looking forward to welcoming you back again in our better circumstances. Kind Regards, Andreya Iswara"
Lisa,United States,Standard Villa,1 night,Couple,01-10-2024 00:00:00,Too many flies,3.0,en-us,The staff was very helpful and accommodating.,"FLIES!!!!! Only there one night in January. The flies had us spraying our room with a lot of insecticide. They were so bad in the dining area we ate inside our room. Felt a bit trapped inside. Also thought there would be a lake view from the property, wrong.","title: Too many flies. liked: The staff was very helpful and accommodating. disliked: FLIES!!!!! Only there one night in January. The flies had us spraying our room with a lot of insecticide. They were so bad in the dining area we ate inside our room. Felt a bit trapped inside. Also thought there would be a lake view from the property, wrong.","title: Too many flies. liked: The staff was very helpful and accommodating. disliked: FLIES!!!!! Only there one night in January. The flies had us spraying our room with a lot of insecticide. They were so bad in the dining area we ate inside our room. Felt a bit trapped inside. Also thought there would be a lake view from the property, wrong.",0,0,"Dear Ms. Lisa, Thank you very much for taking up your time to wrote a valuable review for us. All of the feedback is accepted towards our improvement. If time brought you back again to Bedugul, we would like to welcoming you again in our better circumstances. Kind Regards, Putu Andre Operational Manager"
Noor,United States,Villa,1 night,Family,12-11-2023 00:00:00,Exceptional,10.0,en-us,unique place,,title: Exceptional. liked: unique place.,title: Exceptional. liked: unique place.,0,0,
Frank,Germany,Standard Villa,2 nights,Couple,12-12-2025 00:00:00,"Empfehlenswert, allerdings nicht für Gäste geeignet, die nur Hotelurlaube mit Fullservice gewöhnt sind.",7.0,de,Die ruhige Lage an See,Es gab leider kein warmes Wasser zum Duschen. Hätte man bei den kühleren Temperaturen morgens brauchen können.,"title: Empfehlenswert, allerdings nicht für Gäste geeignet, die nur Hotelurlaube mit Fullservice gewöhnt sind. liked: Die ruhige Lage an See. disliked: Es gab leider kein warmes Wasser zum Duschen. Hätte man bei den kühleren Temperaturen morgens brauchen können.",,0,0,
Dorota,Poland,Villa,1 night,Group,11-15-2025 00:00:00,Very good,8.0,pl,"cisza, czystość","zimne noce ,brak dodatkowego koca","title: Very good. liked: cisza, czystość. disliked: zimne noce ,brak dodatkowego koca.",,0,0,"Dear Mr/s. Dorote, Thank you for your spending your time to wrote a valuable feedback for us. We are glad to know that your time at Navalia Villa. An extra blanket are available based on request and we are happy to giving it in a cold night. Once again thank you very much and we are look forward to welcoming you again in our better circumstances. Regards, Putu Andre"
Marc,France,Standard Villa,2 nights,Solo traveller,11-11-2025 00:00:00,Good,7.0,fr,"Personnel adorable, le restaurant de l’hôtel est bon. Très jolie chambre, wifi très performant.",Des petites fuites lors des gros orages.,"title: Good. liked: Personnel adorable, le restaurant de l’hôtel est bon. Très jolie chambre, wifi très performant. disliked: Des petites fuites lors des gros orages.",,0,0,"Dear Mr. Marc, Thank you for your spending your time to wrote a valuable feedback for us. We are glad to know that your time at Navalia Villa. We do apologize for the inconvenience regarding the small leaks during the storms and we have fixed it immediately. Once again thank you very much and we are look forward to welcoming you again in our better circumstances. Regards, Putu Andre"
Angela,Germany,Standard Villa,2 nights,Couple,10-29-2025 00:00:00,Ruhig und abgelegen,7.0,de,"Super nette Mitarbeiter. Wir haben erst am Morgen ca 2 Stunden vor Anreise gebucht und die Mitarbeiter haben es möglich gemacht, dass wir gleich unser Zimmer beziehen durften. Ganz so hell wie auf den Fotos war es nicht, aber es war gemütlich und alles funktionierte und es war sauber. Schöner gepflegter Garten. Sehr gutes Preis/Leistungsverhältnis.","Die Lage war zwar absolut ruhig, aber es war mir doch etwas zu abgelegen nach meinem subjektiven Empfinden. Das nächste Mal würde ich etwas mit Aussicht auf den Hügeln buchen. In den Ort eine halbe Stunde zu Fuß. Die Unterkunft hat meine Erwartungen deshalb nur bedingt erfüllt.","title: Ruhig und abgelegen. liked: Super nette Mitarbeiter. Wir haben erst am Morgen ca 2 Stunden vor Anreise gebucht und die Mitarbeiter haben es möglich gemacht, dass wir gleich unser Zimmer beziehen durften. Ganz so hell wie auf den Fotos war es nicht, aber es war gemütlich und alles funktionierte und es war sauber. Schöner gepflegter Garten. Sehr gutes Preis/Leistungsverhältnis. disliked: Die Lage war zwar absolut ruhig, aber es war mir doch etwas zu abgelegen nach meinem subjektiven Empfinden. Das nächste Mal würde ich etwas mit Aussicht auf den Hügeln buchen. In den Ort eine halbe Stunde zu Fuß. Die Unterkunft hat meine Erwartungen deshalb nur bedingt erfüllt.",,0,0,"Dear Ms. Angela Thank you for your spending your time to wrote a valuable feedback for us. We are glad to know that your time at Navalia Villa. We do apologized if our place doesn't met your expectation regarding the view and the location. Yes we are located in a remote village and the view only at our garden and a partially mountain sometimes in a sunny day. But the Beratan lake is only a walking distance. Once again thank you very much for the review and we are look forward to welcoming you again in our better circumstances. Regards, Putu Andre"
Clara,France,Standard Villa,1 night,Solo traveller,09-27-2025 00:00:00,Charmant séjour,9.0,fr,"Chambre confortable et intimiste avec du charme, personnel très serviable et agréable, restaurant sur place à bon prix","Eau de la douche tiède, isolement sonore de la chambre moyen (mais le lieu est calme), pas d'AC (mais les nuits sont fraiches donc cela ne pose pas problème)","title: Charmant séjour. liked: Chambre confortable et intimiste avec du charme, personnel très serviable et agréable, restaurant sur place à bon prix. disliked: Eau de la douche tiède, isolement sonore de la chambre moyen (mais le lieu est calme), pas d'AC (mais les nuits sont fraiches donc cela ne pose pas problème)",,0,0,
Abdullah,Saudi Arabia,Superior Villa,3 nights,Group,09-15-2025 00:00:00,جيد لمن يحب السفر وليس ذو مطالب عالية,9.0,ar,الموقع كان جميل بالنسبة لي، منعزل بعيد عن ازعاج المدينة و السيارات و الدبابات المنطقة باردة و تمسي ابرد في الليل يوجد مطعم متواضع تابع للمكان يطبخون اطباق جيدة و تفي للفطور و العشاء لكنه ليس متنوع لذلك ربما امل بعد عدة ايام طلبت تضيف الغرفة في اليوم الثاني و قاموا بترتيبها جيدا يوجد مياه ساخنة و فرشات اسنان الموظفين جدمتعاونون جدا طلبت استئجار دباب و تم توفيرا لي بعد الاتفاق كلفني 100 ألف في اليوم الغرفة واسعة و دورت المياه جيدة,البسة الفرش كانت متسخة في اليوم الاول و في اليوم الثالث طلبت تبديلها تم ذلك لكن جأتني متسخة ببقع أخرى ربما الغسالات عندهم لا تعمل بالشكل الجيد لان رائحتها كانت جيدة ولكن مبقعة بالنسبة لي لم يكن شيء مزعجا بشكل كبير😁 الموقع في الليل يعتبر الطريق له مضلم و موحش لو كنت ستاتي الى الفندق مشيا بالنسبة لي كان شيء جيدا لاني تعمدت البحث عن مكان منعزل,title: جيد لمن يحب السفر وليس ذو مطالب عالية. liked: الموقع كان جميل بالنسبة لي، منعزل بعيد عن ازعاج المدينة و السيارات و الدبابات المنطقة باردة و تمسي ابرد في الليل يوجد مطعم متواضع تابع للمكان يطبخون اطباق جيدة و تفي للفطور و العشاء لكنه ليس متنوع لذلك ربما امل بعد عدة ايام طلبت تضيف الغرفة في اليوم الثاني و قاموا بترتيبها جيدا يوجد مياه ساخنة و فرشات اسنان الموظفين جدمتعاونون جدا طلبت استئجار دباب و تم توفيرا لي بعد الاتفاق كلفني 100 ألف في اليوم الغرفة واسعة و دورت المياه جيدة. disliked: البسة الفرش كانت متسخة في اليوم الاول و في اليوم الثالث طلبت تبديلها تم ذلك لكن جأتني متسخة ببقع أخرى ربما الغسالات عندهم لا تعمل بالشكل الجيد لان رائحتها كانت جيدة ولكن مبقعة بالنسبة لي لم يكن شيء مزعجا بشكل كبير😁 الموقع في الليل يعتبر الطريق له مضلم و موحش لو كنت ستاتي الى الفندق مشيا بالنسبة لي كان شيء جيدا لاني تعمدت البحث عن مكان منعزل.,,0,0,
Samuel,France,Standard Villa,1 night,Couple,09-01-2025 00:00:00,note de 8,8.0,fr,"très beau, chambre spacieuse, personnel au top.",pas d'eau chaude (très tiède) malgré l'intervention d'un membre du personnel et repas du soir un peu bâclé... pas de proposition de boissons pendant le repas literie un peu dure,"title: note de 8. liked: très beau, chambre spacieuse, personnel au top. disliked: pas d'eau chaude (très tiède) malgré l'intervention d'un membre du personnel et repas du soir un peu bâclé... pas de proposition de boissons pendant le repas literie un peu dure.",,0,0,
Stephane,France,Villa,2 nights,Family,09-01-2025 00:00:00,Very good,8.0,fr,Belle chambre,Accès un peu compliqué en voiture,title: Very good. liked: Belle chambre. disliked: Accès un peu compliqué en voiture.,,0,0,
Marga,Spain,Villa,3 nights,Group,08-25-2025 00:00:00,Good,7.0,es,"La ubicacion es perfecta para visitar la zona norte, pero caminando es complicado ir a ningun lugar La casita era muy bonita y el desayuno correcto El personal muy amable, pero el restaurante-cafeteria esta cerrada solo te dan el desayuno",,"title: Good. liked: La ubicacion es perfecta para visitar la zona norte, pero caminando es complicado ir a ningun lugar La casita era muy bonita y el desayuno correcto El personal muy amable, pero el restaurante-cafeteria esta cerrada solo te dan el desayuno.",,0,0,
Devran,Turkey,Standard Villa,1 night,Solo traveller,05-23-2025 00:00:00,Good,7.0,tr,Çalışanlar güler yüzlü,"Çarşaflar çok lekeliydi, klima yoktu ve soğuktu, hijyen konusunda hiç rahat edemedim, ama fiyatı makul tabi.","title: Good. liked: Çalışanlar güler yüzlü. disliked: Çarşaflar çok lekeliydi, klima yoktu ve soğuktu, hijyen konusunda hiç rahat edemedim, ama fiyatı makul tabi.",,0,0,
Geraldine,France,Standard Villa,2 nights,Family,05-04-2025 00:00:00,Authentique,8.0,fr,La gentillesse et disponibilité du personnel . La proximité de lieux incontournables dans le nord,,title: Authentique. liked: La gentillesse et disponibilité du personnel . La proximité de lieux incontournables dans le nord.,,0,0,
Samir,France,Standard Villa,2 nights,Couple,04-17-2025 00:00:00,Superb,9.0,fr,"Nous avons passé un bon séjour au sein de Navalia Villa Bedugul. Le personnel est très agréable et souriant, à votre écoute et prêt à vous aider. L’établissement possède un petit restaurant avec une carte assez complète à des prix plus que raisonnable. Pour les musulmans et musulmanes, il y a une petite mosquée au sein de l’établissement avec toilette et espace pour faire ses ablutions. Le seul bémol est qu’il n’y a pas de salle pour homme et femme mais une seule et même salle.",,"title: Superb. liked: Nous avons passé un bon séjour au sein de Navalia Villa Bedugul. Le personnel est très agréable et souriant, à votre écoute et prêt à vous aider. L’établissement possède un petit restaurant avec une carte assez complète à des prix plus que raisonnable. Pour les musulmans et musulmanes, il y a une petite mosquée au sein de l’établissement avec toilette et espace pour faire ses ablutions. Le seul bémol est qu’il n’y a pas de salle pour homme et femme mais une seule et même salle.",,0,0,
Sibylle,Germany,Standard Villa,3 nights,Couple,03-27-2025 00:00:00,Good,7.0,de,"Nette kleine Anlage, etwas abgelegen und auch keine schöne Lobby. Die Zimmer waren sehr Einfach aber schön und sauber, leider keine Klimaanlage! Hatten günstiger gleichwertige Unterkünfte. Im Restaurant konnte man sehr gut essen, wurde alles frisch zubereitet.",,"title: Good. liked: Nette kleine Anlage, etwas abgelegen und auch keine schöne Lobby. Die Zimmer waren sehr Einfach aber schön und sauber, leider keine Klimaanlage! Hatten günstiger gleichwertige Unterkünfte. Im Restaurant konnte man sehr gut essen, wurde alles frisch zubereitet.",,0,0,
Helena,Czech Republic,Villa,1 night,Family,03-20-2025 00:00:00,Superb,9.0,cs,Netekla teplá voda,,title: Superb. liked: Netekla teplá voda.,,0,0,
