username,user_country,room_view,stay_duration,stay_type,review_post_date,review_title,rating,original_lang,review_text_liked,review_text_disliked,full_review,en_full_review,found_helpful,found_unhelpful,owner_resp_text
Shahyad,Canada,Standard Villa,2 nights,Couple,01-27-2024 00:00:00,Cute little spot,8.0,en-us,"Cosy spot , still getting built , little noise but all good",They need a fan for the bathrooms ..,"title: Cute little spot. liked: Cosy spot , still getting built , little noise but all good. disliked: They need a fan for the bathrooms ..","title: Cute little spot. liked: Cosy spot , still getting built , little noise but all good. disliked: They need a fan for the bathrooms ..",0,0,"Dear Mr/s. Shahyad, Thank you very much for taking up your valuable time to wrote us a valuable review We are looking forward to welcoming you back again in our better circumstances. Kind Regards, Andreya Iswara"
Rathgalla,Australia,Deluxe Villa,2 nights,Couple,01-16-2024 00:00:00,Superb,9.0,en,Comfortable villas.. Friendly staff who are very accommodating and helpful. Close to the lake. Morning walk 🚶‍♀️ ✨️ 💕. Beautiful scenery and good weather 👌 We will visit again,Hot water had issues... no air-conditioning.,title: Superb. liked: Comfortable villas.. Friendly staff who are very accommodating and helpful. Close to the lake. Morning walk 🚶‍♀️ ✨️ 💕. Beautiful scenery and good weather 👌 We will visit again. disliked: Hot water had issues... no air-conditioning.,title: Superb. liked: Comfortable villas.. Friendly staff who are very accommodating and helpful. Close to the lake. Morning walk 🚶‍♀️ ✨️ 💕. Beautiful scenery and good weather 👌 We will visit again. disliked: Hot water had issues... no air-conditioning.,0,0,"Dear Rathgalla Shiyanga, We are all so happy to know that you've enjoy your stay with us. We do apologize regarding the hot water issue that ruin your stay. If time brought you back again to Bedugul, we would definitely love to welcoming you back again in our better circumstances. Kind Regards, Andre Operations Manager"
Feancois,Indonesia,Standard Villa,2 nights,Family,12-19-2023 00:00:00,Near the lake and walking distance from botanical gardens. Enjoy some of the local living.,9.0,en,The view and comfortable rooms.,None,title: Near the lake and walking distance from botanical gardens. Enjoy some of the local living. liked: The view and comfortable rooms. disliked: None.,title: Near the lake and walking distance from botanical gardens. Enjoy some of the local living. liked: The view and comfortable rooms. disliked: None.,0,0,"Dear Mr. Feancois, Thank you very much for your valuable review. We are glad to know that you enjoyed the ambiance or the local living in Bedugul. We looking forward to welcoming you back if time brought you back again to Bedugul. Regards, Andre"
Ida,Indonesia,Villa,2 nights,Group,12-19-2023 00:00:00,Would come back definitely,8.0,en,Breakfast was simple but delicious. Location is great,,title: Would come back definitely. liked: Breakfast was simple but delicious. Location is great.,title: Would come back definitely. liked: Breakfast was simple but delicious. Location is great.,0,0,"Dear Ibu Ida, Thank you very much for your valuable review. We all here looking forward to welcoming you again in our better circumstances. Regards, Andre"
Kavitha,United States,Standard Villa,2 nights,Solo traveller,10-09-2023 00:00:00,Great hotel off the beaten path,7.0,en-us,Nice villa and restaurant on site. Off the beaten path,Hard to find transportation options in this part of Bali. Very difficult to get around and not touristy.,title: Great hotel off the beaten path. liked: Nice villa and restaurant on site. Off the beaten path. disliked: Hard to find transportation options in this part of Bali. Very difficult to get around and not touristy.,title: Great hotel off the beaten path. liked: Nice villa and restaurant on site. Off the beaten path. disliked: Hard to find transportation options in this part of Bali. Very difficult to get around and not touristy.,1,0,"Dear Ms. Kavitha Thank you for spending your time to wrote a valuable review for us, it helps us towards our improvement. If time brought you back again to Bedugul, we are all love to welcoming you again. Regards, Andre"
Filipe,Portugal,Standard Villa,2 nights,Couple,10-05-2023 00:00:00,Good,7.0,en,"Chilled place, a bit far away from the “center”. But with a scooter it’s ok.","The bathroom had a chlorine smell since it hasn’t any windows to pass the air. The breakfast included only fruits, coffee and nasi/mie goreng, the pancakes and fried banana was charged apart.","title: Good. liked: Chilled place, a bit far away from the “center”. But with a scooter it’s ok. disliked: The bathroom had a chlorine smell since it hasn’t any windows to pass the air. The breakfast included only fruits, coffee and nasi/mie goreng, the pancakes and fried banana was charged apart.","title: Good. liked: Chilled place, a bit far away from the “center”. But with a scooter it’s ok. disliked: The bathroom had a chlorine smell since it hasn’t any windows to pass the air. The breakfast included only fruits, coffee and nasi/mie goreng, the pancakes and fried banana was charged apart.",0,0,"Dear Mr. Filipe, Thank you very much for your spending your precious time to wrote a valuable review for us. Such a valuable feedback for our fresh and newly open cottages in this area. Of note, we notice that we didn't have a circulation windows due to there was a farm beside us and we were worried about too many bugs getting into the bathroom. We will look for other ways to ensure maximum comfort for our guests. We look forward to welcoming you again here if time brings you back again to Bedugul. Regards, Andre"
Harang,France,Standard Villa,2 nights,Couple,03-16-2026 00:00:00,Exceptional,10.0,en,All was very nice,Ras,title: Exceptional. liked: All was very nice. disliked: Ras.,title: Exceptional. liked: All was very nice. disliked: Ras.,0,0,
Frank,Netherlands,Superior Villa,7 nights,Couple,12-08-2025 00:00:00,Colder place than expected,6.0,en,"The staff was nice, kind yet a bit young and unexperienced, in my opinion.","Mostly the weather, cloudy, rainy, cold! We left early","title: Colder place than expected. liked: The staff was nice, kind yet a bit young and unexperienced, in my opinion. disliked: Mostly the weather, cloudy, rainy, cold! We left early.","title: Colder place than expected. liked: The staff was nice, kind yet a bit young and unexperienced, in my opinion. disliked: Mostly the weather, cloudy, rainy, cold! We left early.",1,0,
Maciej,Poland,Superior Villa,1 night,Solo traveller,12-02-2025 00:00:00,Good Location,6.0,en,The villa is close to the lake and to a hiking trail.,The room was moist. It was difficult to dry clothes inside. Fungus was growing in the bathroom due to lack of ventilation. The furniture was in poor condition. Bedsheets had some random stains.,title: Good Location. liked: The villa is close to the lake and to a hiking trail. disliked: The room was moist. It was difficult to dry clothes inside. Fungus was growing in the bathroom due to lack of ventilation. The furniture was in poor condition. Bedsheets had some random stains.,title: Good Location. liked: The villa is close to the lake and to a hiking trail. disliked: The room was moist. It was difficult to dry clothes inside. Fungus was growing in the bathroom due to lack of ventilation. The furniture was in poor condition. Bedsheets had some random stains.,0,0,
Cameron,Australia,Villa,1 night,Group,09-14-2025 00:00:00,Very peaceful and relaxing place to visit. I want to spend more time there.,10.0,en,"Beautiful interior and exterior architecture, nicely maintained gardens.",Needed another quilt on the bed. It was cold there!,"title: Very peaceful and relaxing place to visit. I want to spend more time there. liked: Beautiful interior and exterior architecture, nicely maintained gardens. disliked: Needed another quilt on the bed. It was cold there!","title: Very peaceful and relaxing place to visit. I want to spend more time there. liked: Beautiful interior and exterior architecture, nicely maintained gardens. disliked: Needed another quilt on the bed. It was cold there!",0,0,
Thilo,Indonesia,Villa,1 night,Group,09-02-2025 00:00:00,Hotel seems to cater mainly for local guests and has little experience with western guests.,3.0,en,"No warm water in all 3 bungalows. After staff repaired the hot water system (so they said) there was still no warm water. Though staff tried, the service was generally very basic and extremely slow and had no knowledge of the tourist area around them.",,"title: Hotel seems to cater mainly for local guests and has little experience with western guests. liked: No warm water in all 3 bungalows. After staff repaired the hot water system (so they said) there was still no warm water. Though staff tried, the service was generally very basic and extremely slow and had no knowledge of the tourist area around them.","title: Hotel seems to cater mainly for local guests and has little experience with western guests. liked: No warm water in all 3 bungalows. After staff repaired the hot water system (so they said) there was still no warm water. Though staff tried, the service was generally very basic and extremely slow and had no knowledge of the tourist area around them.",0,0,
Annette,New Zealand,Standard Villa,2 nights,Couple,04-21-2025 00:00:00,Pleasant,6.0,en,Adi was wonderful and so welcoming and helpful. Rooms were nice.,"Thought location from maps was on lake, but it has no lake view as on other side. Damp smell.","title: Pleasant. liked: Adi was wonderful and so welcoming and helpful. Rooms were nice. disliked: Thought location from maps was on lake, but it has no lake view as on other side. Damp smell.","title: Pleasant. liked: Adi was wonderful and so welcoming and helpful. Rooms were nice. disliked: Thought location from maps was on lake, but it has no lake view as on other side. Damp smell.",0,0,"Dear Ms. Annete Thank you very much for your review for us. And thank you for your compliment to our staff, Adi. Regarding the lake view, we actually has mentioned it in our page and our picture that indicate where our location is. We would like to inform a clear direction and condition of our location. Again, thank you very much for the review and your stay. Look forward to welcoming you again. Regards, Putu Andre"
Asmara,Indonesia,Standard Villa,1 night,Family,01-21-2025 00:00:00,Wonderfull experience with family,10.0,en,"Great place near from the lake, about 10 mins from the center. To get the place guest need to pay IDR10,000 for entrance fee due to located a t conservation area and only pay once for entire stay. The breakfast was nice and the price is affordable compare to any place around. Staff were nice and give their best to make the stay awesome.",None. Overall I’m satisfied.,"title: Wonderfull experience with family. liked: Great place near from the lake, about 10 mins from the center. To get the place guest need to pay IDR10,000 for entrance fee due to located a t conservation area and only pay once for entire stay. The breakfast was nice and the price is affordable compare to any place around. Staff were nice and give their best to make the stay awesome. disliked: None. Overall I’m satisfied.","title: Wonderfull experience with family. liked: Great place near from the lake, about 10 mins from the center. To get the place guest need to pay IDR10,000 for entrance fee due to located a t conservation area and only pay once for entire stay. The breakfast was nice and the price is affordable compare to any place around. Staff were nice and give their best to make the stay awesome. disliked: None. Overall I’m satisfied.",0,0,
Nikhil,India,Standard Villa,1 night,Couple,12-20-2024 00:00:00,"Bad odour in the room, not clean. Not at all worth the price.",3.0,en,"Only the location is good, It is closer to the lake. Other than that, the stay only looks good to see but smells very bad. The staff were very friendly, I requested them to clean the room and remove the bugs and they did it immediately.","The room smelled very bad. I was getting a variety of bad odour inside the room. Looks like these guys don't know how to run a stay. There is no fridge in the room, the sheets smelled bad, bed shelled bad and the entire room smelled bad. There are tiny cockroaches running around in the room. There were stains in the curtains, looks like it's was never cleaned. The bathroom was ok but it does not have ventilation. So all the bad odors from the toilet enters the room. I wouldn't prefer returning to this place ever again.","title: Bad odour in the room, not clean. Not at all worth the price. liked: Only the location is good, It is closer to the lake. Other than that, the stay only looks good to see but smells very bad. The staff were very friendly, I requested them to clean the room and remove the bugs and they did it immediately. disliked: The room smelled very bad. I was getting a variety of bad odour inside the room. Looks like these guys don't know how to run a stay. There is no fridge in the room, the sheets smelled bad, bed shelled bad and the entire room smelled bad. There are tiny cockroaches running around in the room. There were stains in the curtains, looks like it's was never cleaned. The bathroom was ok but it does not have ventilation. So all the bad odors from the toilet enters the room. I wouldn't prefer returning to this place ever again.","title: Bad odour in the room, not clean. Not at all worth the price. liked: Only the location is good, It is closer to the lake. Other than that, the stay only looks good to see but smells very bad. The staff were very friendly, I requested them to clean the room and remove the bugs and they did it immediately. disliked: The room smelled very bad. I was getting a variety of bad odour inside the room. Looks like these guys don't know how to run a stay. There is no fridge in the room, the sheets smelled bad, bed shelled bad and the entire room smelled bad. There are tiny cockroaches running around in the room. There were stains in the curtains, looks like it's was never cleaned. The bathroom was ok but it does not have ventilation. So all the bad odors from the toilet enters the room. I wouldn't prefer returning to this place ever again.",0,0,"Dear Mr. Nikhil and partner, Thank you for your recent stay at Navalia Villa. We do apologize that during your stay we couldn't deliver a service that meet your expectation. Honestly the nonstop raining we have nowadays causing a big issue to our area moreover we are in the middle of the farm causing some insect and flies come over to our place. Yes we don't have a fridge in our room that why we didn't mention it in our page, but you can still ask our staff to keep your things in our fridge in the kitchen. Once again we do apologize for your experience, wishing you have a great day and thank you for your stay. Regards, Putu Andre"
Janneke,Netherlands,Standard Villa,1 night,Couple,11-01-2024 00:00:00,"A very nice, quiet, peaceful, relaxing place",10.0,en,The bed was really good. The place itself was very clean and cosy. The staff was incredibly helpful and nice and are doing everything to make your stay unforgettable.,"There were a lot of flies in the cabin, which could easily be solved by installing some fly catchers in the room. The coffee that was provided and made by the staff was not the best, but the coffee you get in the room (in small sachets )was much, much better. Other than that, nothing was bad","title: A very nice, quiet, peaceful, relaxing place. liked: The bed was really good. The place itself was very clean and cosy. The staff was incredibly helpful and nice and are doing everything to make your stay unforgettable. disliked: There were a lot of flies in the cabin, which could easily be solved by installing some fly catchers in the room. The coffee that was provided and made by the staff was not the best, but the coffee you get in the room (in small sachets )was much, much better. Other than that, nothing was bad.","title: A very nice, quiet, peaceful, relaxing place. liked: The bed was really good. The place itself was very clean and cosy. The staff was incredibly helpful and nice and are doing everything to make your stay unforgettable. disliked: There were a lot of flies in the cabin, which could easily be solved by installing some fly catchers in the room. The coffee that was provided and made by the staff was not the best, but the coffee you get in the room (in small sachets )was much, much better. Other than that, nothing was bad.",0,0,"Dear Mr. Van Oers, Thank you very much for your valuable review for us. It helps us a lot towards our improvement. We always take a note of every guest feedback in order to deliver an excellent service for all our our customer. Once again, thank you very much. We are looking forward to have you here again with us. Regards, Putu Andre"
Jodie,Australia,Villa,2 nights,Group,10-21-2024 00:00:00,This property has more learning to do before it accepts guests.,5.0,en,The gardens were lovely. Mattress was comfortable.,"The signage for the property is minimal, so it was hard to find. The family villa has a bedroom and a cell with no door for the second bedroom. Mosquitos are a problem. Hot water didn’t work until we asked it to be fixed (twice). We witnessed the same problem for other guests staying too. The bathroom had no ventilation. There were no additional blankets to use if required. We had to ask for the correct number of towels, glasses etc so each guests staying was catered for. Even then, there were not enough to be provided then, so we didn’t receive any until the next day. Dropping from insects/lizards that live in the thatched roof were all over the bed. Two of our group got sick from eating food at the onsite restaurant. Food handling, storage and preparation needs to be improved or this will continue to reoccur with guests. Items on menu were not available. Restaurant didn’t open on time. Food took a long time to be served. Other guests staying were above the capacity of the amount allowable for each room. They were noisy until late in the evening and then again early in the morning, even when we requested them to be quiet. No consideration of other guests (and these were Indonesians!) Staff did not intervene on our behalf, but were aware. Staff are too young and inexperienced to overcome challenges independently. There needs to be a manager onsite to provide leadership.","title: This property has more learning to do before it accepts guests. liked: The gardens were lovely. Mattress was comfortable. disliked: The signage for the property is minimal, so it was hard to find. The family villa has a bedroom and a cell with no door for the second bedroom. Mosquitos are a problem. Hot water didn’t work until we asked it to be fixed (twice). We witnessed the same problem for other guests staying too. The bathroom had no ventilation. There were no additional blankets to use if required. We had to ask for the correct number of towels, glasses etc so each guests staying was catered for. Even then, there were not enough to be provided then, so we didn’t receive any until the next day. Dropping from insects/lizards that live in the thatched roof were all over the bed. Two of our group got sick from eating food at the onsite restaurant. Food handling, storage and preparation needs to be improved or this will continue to reoccur with guests. Items on menu were not available. Restaurant didn’t open on time. Food took a long time to be served. Other guests staying were above the capacity of the amount allowable for each room. They were noisy until late in the evening and then again early in the morning, even when we requested them to be quiet. No consideration of other guests (and these were Indonesians!) Staff did not intervene on our behalf, but were aware. Staff are too young and inexperienced to overcome challenges independently. There needs to be a manager onsite to provide leadership.","title: This property has more learning to do before it accepts guests. liked: The gardens were lovely. Mattress was comfortable. disliked: The signage for the property is minimal, so it was hard to find. The family villa has a bedroom and a cell with no door for the second bedroom. Mosquitos are a problem. Hot water didn’t work until we asked it to be fixed (twice). We witnessed the same problem for other guests staying too. The bathroom had no ventilation. There were no additional blankets to use if required. We had to ask for the correct number of towels, glasses etc so each guests staying was catered for. Even then, there were not enough to be provided then, so we didn’t receive any until the next day. Dropping from insects/lizards that live in the thatched roof were all over the bed. Two of our group got sick from eating food at the onsite restaurant. Food handling, storage and preparation needs to be improved or this will continue to reoccur with guests. Items on menu were not available. Restaurant didn’t open on time. Food took a long time to be served. Other guests staying were above the capacity of the amount allowable for each room. They were noisy until late in the evening and then again early in the morning, even when we requested them to be quiet. No consideration of other guests (and these were Indonesians!) Staff did not intervene on our behalf, but were aware. Staff are too young and inexperienced to overcome challenges independently. There needs to be a manager onsite to provide leadership.",0,0,"Dear Ms. Jodie, Thank you very much for spending your time to wrote a very detail review for us. We do apologize for not meet your satisfaction during your stay and have learn from a lot from your review toward our improvement. If times brought you back again to Bali, we wish to welcoming you again in our better circumstances. Regards, Putu Andre"
Jillian,Australia,Superior Villa,2 nights,Couple,08-11-2024 00:00:00,Disappointing,4.0,en,The staff tried very hard to be friendly and helpful,This review is for the very old and probably the original villa. It is listed on booking.com as Twin. There are newer villas that look much better. There were no windows and ventilation was via a small hatch the door was also made of timber compared to the newer villas which were glass and with a view outside. The worst aspect of this villa was a bathroom with no ventilation Over the years the grouting had become dirty and full of grime. There was black mould on the ceiling It was not up to an acceptable standard Again the staff tried hard in the restaurant but an hour wait for a meal showed a lack of staff. Food basic There is NO view of the Lake,title: Disappointing. liked: The staff tried very hard to be friendly and helpful. disliked: This review is for the very old and probably the original villa. It is listed on booking.com as Twin. There are newer villas that look much better. There were no windows and ventilation was via a small hatch the door was also made of timber compared to the newer villas which were glass and with a view outside. The worst aspect of this villa was a bathroom with no ventilation Over the years the grouting had become dirty and full of grime. There was black mould on the ceiling It was not up to an acceptable standard Again the staff tried hard in the restaurant but an hour wait for a meal showed a lack of staff. Food basic There is NO view of the Lake.,title: Disappointing. liked: The staff tried very hard to be friendly and helpful. disliked: This review is for the very old and probably the original villa. It is listed on booking.com as Twin. There are newer villas that look much better. There were no windows and ventilation was via a small hatch the door was also made of timber compared to the newer villas which were glass and with a view outside. The worst aspect of this villa was a bathroom with no ventilation Over the years the grouting had become dirty and full of grime. There was black mould on the ceiling It was not up to an acceptable standard Again the staff tried hard in the restaurant but an hour wait for a meal showed a lack of staff. Food basic There is NO view of the Lake.,0,0,
Haji,United Arab Emirates,Standard Villa,1 night,Solo traveller,06-24-2024 00:00:00,Exceptional,10.0,en-us,Room it’s very clean and stuff it’s very nice,,title: Exceptional. liked: Room it’s very clean and stuff it’s very nice.,title: Exceptional. liked: Room it’s very clean and stuff it’s very nice.,0,0,
Kuiper-piek,Australia,Deluxe Villa,3 nights,Solo traveller,05-31-2024 00:00:00,Pleasant,6.0,en,Located very near lake,"That there was not a fan, so rather stuffy inside. No chair inside.","title: Pleasant. liked: Located very near lake. disliked: That there was not a fan, so rather stuffy inside. No chair inside.","title: Pleasant. liked: Located very near lake. disliked: That there was not a fan, so rather stuffy inside. No chair inside.",0,0,"Dear Ms. Elizabeth, Thank you very much for your detailed review for us. We do apologize regarding the fan, we actually has it on request but perhaps our team member didn't offer it to you. Your review will be really help us toward our improvement. If time brought you back again to Bedugul, we are looking forward to welcoming you again. Regards, Putu Andre"
